title,url
Триммер садовый электрический для травы Garden,https://www.wildberries.ru/catalog/209650955/detail.aspx
Триммер аккумуляторный садовый дачный кусторез VOYOR,https://www.wildberries.ru/catalog/77278318/detail.aspx
"Триммер аккумуляторный GreenCut 20 (20В, акб 2шт) Zitrek",https://www.wildberries.ru/catalog/18565737/detail.aspx
Триммер аккумуляторный садовый дачный кусторез VOYOR,https://www.wildberries.ru/catalog/113066515/detail.aspx
Триммер-газонокосилка аккумуляторный GreenCut 20 Pro Zitrek,https://www.wildberries.ru/catalog/151530782/detail.aspx
Триммер для травы аккумуляторный садовый ручной мощный HuoGuo,https://www.wildberries.ru/catalog/164885226/detail.aspx
Триммер садовый Семирот,https://www.wildberries.ru/catalog/208141196/detail.aspx
"Леска для триммера звезда 2,4мм 100м Polyagro",https://www.wildberries.ru/catalog/145821973/detail.aspx
"Катушка для триммера, леска для триммера Штукарь",https://www.wildberries.ru/catalog/81408162/detail.aspx
Кусторез триммер садовый аккумуляторный FORTBERG,https://www.wildberries.ru/catalog/202528239/detail.aspx
Триммер аккумуляторный для травы садовый HORDER,https://www.wildberries.ru/catalog/209801388/detail.aspx
Леска для триммера квадрат 3 мм 100 м Polyagro,https://www.wildberries.ru/catalog/145821971/detail.aspx
Триммер для травы аккумуляторный садовый ручной мощный HuoGuo,https://www.wildberries.ru/catalog/166091882/detail.aspx
Катушка для триммера садового леска насадка для триммера,https://www.wildberries.ru/catalog/208929943/detail.aspx
"Набор аккумуляторного инструмента 2 в 1, 2х2.0Ач Zitrek",https://www.wildberries.ru/catalog/156114215/detail.aspx
Насадка на триммер бензиновый электрический насадка для триммера,https://www.wildberries.ru/catalog/210307736/detail.aspx
Катушка для триммера Y-A002 TITAN /,https://www.wildberries.ru/catalog/151723698/detail.aspx
Универсальная шпуля-головка T35 для триммера Husqvarna GaminGo,https://www.wildberries.ru/catalog/70070913/detail.aspx
Леска для катушки триммера 2.4 мм звезда BARSIKhome,https://www.wildberries.ru/catalog/83254734/detail.aspx
Триммер садовый аккумуляторный 2 в 1 DKTR40 063-4230 DEKO,https://www.wildberries.ru/catalog/39727485/detail.aspx
"Прочная леска для триммера квадрат 2,4мм Югай",https://www.wildberries.ru/catalog/76566433/detail.aspx
"Леска для триммера 2,4мм 15м звезда TRIMMER LINE",https://www.wildberries.ru/catalog/158256245/detail.aspx
"Прочная армированная леска для триммера от 2,4 до 4 мм Югай",https://www.wildberries.ru/catalog/153270175/detail.aspx
Ремень наплечный для триммера. Профессиональный ранцевый GaminGo,https://www.wildberries.ru/catalog/70243028/detail.aspx
Садовый триммер для травы аккумуляторный WITSE,https://www.wildberries.ru/catalog/74250607/detail.aspx
"Катушка для триммера, головка с леской GTH ""Easy Load"" Huter",https://www.wildberries.ru/catalog/95907911/detail.aspx
Нож стальной для триммера садового. Набор 2 шт ElroMos,https://www.wildberries.ru/catalog/158774341/detail.aspx
Садовый триммер для травы аккумуляторный WITSE,https://www.wildberries.ru/catalog/162724263/detail.aspx
"Нож для мотокосы BB0013 Standart 255 x 25,4 x 3T, Multi TUSCAR",https://www.wildberries.ru/catalog/171106503/detail.aspx
"Леска Квадрат, 2,4мм.х158м. на бобине 0,9 кг МастерАлмаз",https://www.wildberries.ru/catalog/83965255/detail.aspx
"Леска звездочка для триммера 2,4 мм*15 м STIHL",https://www.wildberries.ru/catalog/210928422/detail.aspx
Триммер аккумуляторный для травы садовый HORDER,https://www.wildberries.ru/catalog/209801389/detail.aspx
Диск для триммера насадка на триммер Hitman,https://www.wildberries.ru/catalog/88145485/detail.aspx
Головка для триммера катушка на триммер Hitman,https://www.wildberries.ru/catalog/110277654/detail.aspx
"Прочная армированная леска для триммера от 2,4 до 4 мм Югай",https://www.wildberries.ru/catalog/76572141/detail.aspx
Диск для триммера насадка культиватор на триммер Hitman,https://www.wildberries.ru/catalog/154463370/detail.aspx
"Леска для триммера 2,7 мм, длина 15 м CASALINGA",https://www.wildberries.ru/catalog/148516227/detail.aspx
"Леска для триммера 2,7 мм, длина 15 м, синий TiLe.home",https://www.wildberries.ru/catalog/147019572/detail.aspx
"Леска для триммера крученая с нитью, 2,4 мм, длина 15 м CASALINGA",https://www.wildberries.ru/catalog/148686467/detail.aspx
Триммер садовый аккумуляторный GreenCut 20 2x1.5Ач 082-2003 Zitrek,https://www.wildberries.ru/catalog/153619857/detail.aspx
"Триммер садовый электрический DKTR500,складной 065-1210 DEKO",https://www.wildberries.ru/catalog/151532281/detail.aspx
Триммер садовый бензиновый с разборной штангой GGT-1300S Huter,https://www.wildberries.ru/catalog/30087964/detail.aspx
"Триммер электрический Арт. 21217 Basic, 500 Вт, 30 см Greenworks",https://www.wildberries.ru/catalog/8144804/detail.aspx
Триммер для травы садовый кусторез аккумуляторный MustHaveOffers,https://www.wildberries.ru/catalog/208763242/detail.aspx
"Леска для триммера 2,7 мм, длина 15 м CASALINGA",https://www.wildberries.ru/catalog/161310101/detail.aspx
Леска для триммера спираль 15 метров садовая для косилки Meleon,https://www.wildberries.ru/catalog/137697202/detail.aspx
"Леска для триммера 2,7 мм, длина 15 м, синий TiLe.home",https://www.wildberries.ru/catalog/161389798/detail.aspx
"Триммер садовый аккумуляторный DKTR21, 2*2.0Ач, 350 Вт DEKO",https://www.wildberries.ru/catalog/33703287/detail.aspx
Насадка триммерная садовая Green,https://www.wildberries.ru/catalog/212672157/detail.aspx
Леска двухкомпонентная для триммера круглая 2.4 мм Denzel,https://www.wildberries.ru/catalog/165699185/detail.aspx
"Нож диск для триммера садового 20х230х25,4 DarTeh",https://www.wildberries.ru/catalog/210451247/detail.aspx
Леска для триммера звезда с усилением 3.0 мм Югай,https://www.wildberries.ru/catalog/213109941/detail.aspx
Катушка для триммера с цепью бензопилы Jango,https://www.wildberries.ru/catalog/110071755/detail.aspx
Леска для триммера TORGWIN,https://www.wildberries.ru/catalog/162645823/detail.aspx
Бензиновый триммер GGT-2900T PRO Huter,https://www.wildberries.ru/catalog/38124991/detail.aspx
Бензиновый триммер GGT-1900S Huter,https://www.wildberries.ru/catalog/38124992/detail.aspx
Насадка триммерная садовая - Катушка для триммера Green,https://www.wildberries.ru/catalog/212672110/detail.aspx
"Леска для триммера квадрат 2,4 мм 100 м Polyagro",https://www.wildberries.ru/catalog/145821990/detail.aspx
"Прочная армированная леска для триммера от 2,4 до 4 мм Югай",https://www.wildberries.ru/catalog/79099267/detail.aspx
Леска для триммера (оранжевый) Migliores,https://www.wildberries.ru/catalog/58438067/detail.aspx
"Нож для мотокосы BB1054 Premium, 255x25,4x40T, Super Light TUSCAR",https://www.wildberries.ru/catalog/12254594/detail.aspx
"2 в 1 Ножницы кусторез GET-3,6H аккумуляторный садовый 3.6 В Huter",https://www.wildberries.ru/catalog/150809512/detail.aspx
"Катушка для триммера ТУНДРА, полуавтоматическая, подшипник… Удачный участок",https://www.wildberries.ru/catalog/87127420/detail.aspx
"Нож металлический для триммера садового. 4 лезвия, 4-х ElroMos",https://www.wildberries.ru/catalog/175187889/detail.aspx
"Триммер садовый электрический DKTR550, 12000 об мин DEKO",https://www.wildberries.ru/catalog/30165262/detail.aspx
Триммер садовый электрический DKTR1550 065-1211 DEKO,https://www.wildberries.ru/catalog/141630621/detail.aspx
Электрический триммер GET-1500B Huter,https://www.wildberries.ru/catalog/8338414/detail.aspx
"Триммер садовый электрический DKTR1200, леска, нож DEKO",https://www.wildberries.ru/catalog/209741520/detail.aspx
Триммер бензиновый БТР-2500П Ресанта,https://www.wildberries.ru/catalog/66114858/detail.aspx
"Редуктор верхний в сборе для триммера 7 шлицов, D-28мм GaminGo",https://www.wildberries.ru/catalog/148689534/detail.aspx
Леска для триммера квадрат 15 метров садовая для косилки КАЛИБР,https://www.wildberries.ru/catalog/137697828/detail.aspx
для триммера Леска,https://www.wildberries.ru/catalog/159140094/detail.aspx
"Триммер садовый электрический DKTR1150, леска, 1150Вт DEKO",https://www.wildberries.ru/catalog/209738848/detail.aspx
"катушка для триммера универсальная паук, головка триммерная Pikatot",https://www.wildberries.ru/catalog/110613868/detail.aspx
Леска для триммера ДРЕЛЛЕР,https://www.wildberries.ru/catalog/158018340/detail.aspx
Катушка для китайских триммеров HT22 - Z5 CHAMPION,https://www.wildberries.ru/catalog/164147517/detail.aspx
Триммер аккумуляторный DATR 2840Li без АКБ и ЗУ DAEWOO,https://www.wildberries.ru/catalog/81988590/detail.aspx
"Прочная армированная леска для триммера от 2,4 до 4 мм Югай",https://www.wildberries.ru/catalog/163834853/detail.aspx
Бензиновый триммер GGT-2500Т Huter,https://www.wildberries.ru/catalog/38125007/detail.aspx
Бензиновый триммер GGT 1300T Huter,https://www.wildberries.ru/catalog/38125004/detail.aspx
"Триммер садовый аккумуляторный кусторез 3,6 В GET-3,6 Huter",https://www.wildberries.ru/catalog/163558159/detail.aspx
Ремень для триммера ранцевый универсальный ,https://www.wildberries.ru/catalog/93422423/detail.aspx
GGT-2500S PRO Huter,https://www.wildberries.ru/catalog/38125018/detail.aspx
Бензиновый триммер GGT-2500Т PRO Huter,https://www.wildberries.ru/catalog/38125006/detail.aspx
Триммер садовый бензиновый БТР-2500П ПРОФ + подарки Ресанта,https://www.wildberries.ru/catalog/25777133/detail.aspx
Триммер бензиновый GGT-1500SX Huter,https://www.wildberries.ru/catalog/65931217/detail.aspx
Бензиновый триммер GGT-1500T (1500вт) Huter,https://www.wildberries.ru/catalog/38125005/detail.aspx
Триммер бензиновый GGT-800T Huter,https://www.wildberries.ru/catalog/66080383/detail.aspx
Бензиновый триммер GGT-553TA Huter,https://www.wildberries.ru/catalog/142946130/detail.aspx
Триммер GGT 430T Huter,https://www.wildberries.ru/catalog/36533563/detail.aspx
Бензиновый триммер TR-1300T EUROLUX,https://www.wildberries.ru/catalog/37385056/detail.aspx
Ремень наплечный для триммера( одна лямка) GaminGo,https://www.wildberries.ru/catalog/90532166/detail.aspx
Леска для триммера 2мм витой квадрат с сердечником 15м TORGWIN,https://www.wildberries.ru/catalog/159095624/detail.aspx
"Леска для триммера 1,6 ммх15 м - 2 шт STARTUL",https://www.wildberries.ru/catalog/37019144/detail.aspx
Головка триммерная катушка для триммера HAPPY МОЛЛ,https://www.wildberries.ru/catalog/76584771/detail.aspx
Леска для триммера витой квадрат 3 мм Misslight,https://www.wildberries.ru/catalog/160929462/detail.aspx
Диск для триммера универсальный от сорняков Best Room,https://www.wildberries.ru/catalog/177134248/detail.aspx
Катушка для триммеров Bosch ART 24 27 30 (F016800351) Rare-Tool,https://www.wildberries.ru/catalog/156621762/detail.aspx
Триммер бензиновый PT 4555ES Country (неразборная штанга) PATRIOT,https://www.wildberries.ru/catalog/77392242/detail.aspx
Леска для триммера с металлическим сердечником Slendori,https://www.wildberries.ru/catalog/156667550/detail.aspx
"Леска триммерная Nylon Line бесшумная (1.6 мм, 15 м) husqvarna",https://www.wildberries.ru/catalog/79625604/detail.aspx
"Нож для мотокосы BB0084 Premium 230x25,4x40T Saw TUSCAR",https://www.wildberries.ru/catalog/12254579/detail.aspx
Леска для триммера армированная DVAhome's,https://www.wildberries.ru/catalog/162040797/detail.aspx
головка для триммера алюминиевая ЗапчастиElPro,https://www.wildberries.ru/catalog/90417801/detail.aspx
"Леска для триммера 2мм, 2926607 Greenworks",https://www.wildberries.ru/catalog/22901699/detail.aspx
"Триммер садовый аккумуляторный DKTR12, 2*2.0Ач, 12В DEKO",https://www.wildberries.ru/catalog/30165261/detail.aspx
Леска для триммера 2.4 мм 45 метров MaxPiler,https://www.wildberries.ru/catalog/153017312/detail.aspx
"Электрический триммер GET-1500SL, 1500вт Huter",https://www.wildberries.ru/catalog/11452729/detail.aspx
Катушка для турботриммера SmallCut 300 Gardena 05306-20 Rare-Tool,https://www.wildberries.ru/catalog/156625107/detail.aspx
Леска для тримера 4 мм звезда RE HOME,https://www.wildberries.ru/catalog/113173192/detail.aspx
Катушка для триммеров Bosch ART 23 26SL Rare-Tool,https://www.wildberries.ru/catalog/107106980/detail.aspx
Леска для триммера Bosch AFS 23-37 (10шт) сечение квадрат Rare-Tool,https://www.wildberries.ru/catalog/108760154/detail.aspx
Катушка для триммера насадка Насадка на триммер,https://www.wildberries.ru/catalog/213546368/detail.aspx
Крышка катушки для EasyGrassCut F016F05320 Rare-Tool,https://www.wildberries.ru/catalog/156567087/detail.aspx
Крышка катушки для триммеров Bosch ART 24 ART 27 ART 30+ Rare-Tool,https://www.wildberries.ru/catalog/156622341/detail.aspx
Леска для триммера Oregon,https://www.wildberries.ru/catalog/81724469/detail.aspx
"Леска для триммера Profi 1,6 мм, 15 м, профиль ""круг"" kwb",https://www.wildberries.ru/catalog/28881812/detail.aspx
Триммер садовый Ресанта,https://www.wildberries.ru/catalog/35889591/detail.aspx
Триммер бензиновый PT 4555ES Country (неразборная штанга) PATRIOT,https://www.wildberries.ru/catalog/66558690/detail.aspx
"Катушка для триммера универсальная, M10x1.25, алюминий GaminGo",https://www.wildberries.ru/catalog/72281170/detail.aspx
"Леска для триммера 2 мм, 15 м (звезда) Кузьмич",https://www.wildberries.ru/catalog/27127852/detail.aspx
"Леска для триммера 2,4 мм Woldstätte",https://www.wildberries.ru/catalog/76376997/detail.aspx
Триммер садовый ЭТ-1700НВ Ресанта,https://www.wildberries.ru/catalog/32789684/detail.aspx
универсальная алюминиевая паук Головка триммерная,https://www.wildberries.ru/catalog/29665378/detail.aspx
"Набор аккумуляторного инструмента 2в1, 1х2.0,1х4.0Ач Zitrek",https://www.wildberries.ru/catalog/156117733/detail.aspx
Триммер бензиновый Huter,https://www.wildberries.ru/catalog/72740263/detail.aspx
"Триммер садовый бензиновый GGT-1900S, 1900Вт Huter",https://www.wildberries.ru/catalog/30079591/detail.aspx
"Триммер садовый ЭТ-1500Н, 1500 Вт, скашивание леской - 420мм Ресанта",https://www.wildberries.ru/catalog/32789388/detail.aspx
"Триммер садовый ЭТ-1200Н, 1200 Вт Ресанта",https://www.wildberries.ru/catalog/32789196/detail.aspx
Ремень ранцевый для тримера happy boox,https://www.wildberries.ru/catalog/111529924/detail.aspx
Леска для триммера садовой техники косилки газона травы ,https://www.wildberries.ru/catalog/158533040/detail.aspx
"Триммер электрический Арт. 21277 Deluxe, 500 Вт, 30 см Greenworks",https://www.wildberries.ru/catalog/8144805/detail.aspx
Головка триммерная автоматическая загрузка лески С ПЕРЕХОД Krotof,https://www.wildberries.ru/catalog/149705421/detail.aspx
Леска для триммера ДРЕЛЛЕР,https://www.wildberries.ru/catalog/90489650/detail.aspx
Леска для триммера звездочка 15 метров садовая для косилки Meleon,https://www.wildberries.ru/catalog/137598695/detail.aspx
"Триммер электрический Арт. 1301807, 1200 Вт, 40 см Greenworks",https://www.wildberries.ru/catalog/8144788/detail.aspx
Катушка для триммера ДРЕЛЛЕР,https://www.wildberries.ru/catalog/91283189/detail.aspx
"Аккумуляторный триммер GET-36-4Li, 36В, 4 а.ч, 31см Huter",https://www.wildberries.ru/catalog/11452727/detail.aspx
Бензиновый триммер БГ-4500 Минск,https://www.wildberries.ru/catalog/120298839/detail.aspx
Триммер садовый бензиновый GGT-2900T + подарки Huter,https://www.wildberries.ru/catalog/17212739/detail.aspx
Триммер садовый бензиновый GGT-800T + подарки Huter,https://www.wildberries.ru/catalog/17212741/detail.aspx
Триммер садовый бензиновый GGT-553TA Huter,https://www.wildberries.ru/catalog/148566988/detail.aspx
редуктор для триммера B0602 Maxtoolgroup,https://www.wildberries.ru/catalog/100578117/detail.aspx
Триммер садовый бензиновый с разборной штангой GGT-1000S Huter,https://www.wildberries.ru/catalog/30085409/detail.aspx
Леска для триммера витой-квадрат 3.0 мм Бабушка одобряет,https://www.wildberries.ru/catalog/172221094/detail.aspx
Леска для триммера витой-квадрат 2.4 мм Бабушка одобряет,https://www.wildberries.ru/catalog/172224272/detail.aspx
Леска триммер 2.4 косилка травы 2 шт ДОМОВОЙ,https://www.wildberries.ru/catalog/79953744/detail.aspx
"Насадка на триммер T002 полуавтомат, М10х1.25 левая резьба VERTEXTOOLS",https://www.wildberries.ru/catalog/25970242/detail.aspx
Леска для триммера 15 метров Fubag,https://www.wildberries.ru/catalog/39871204/detail.aspx
"Триммер садовый бензиновый, GGT-2500S Huter",https://www.wildberries.ru/catalog/26951263/detail.aspx
Триммер садовый бензиновый BT-2500 STEHER,https://www.wildberries.ru/catalog/148566959/detail.aspx
Триммер садовый бензиновый BT-1300 STEHER,https://www.wildberries.ru/catalog/148566968/detail.aspx
"Леска для триммеров витая, квадрат, армированая, 2 мм 15м CET",https://www.wildberries.ru/catalog/25573651/detail.aspx
Триммер садовый бензиновый GGT-1500S Huter,https://www.wildberries.ru/catalog/30079209/detail.aspx
Триммер бензиновый GGT-2500S PRO Huter,https://www.wildberries.ru/catalog/78402583/detail.aspx
"Катушка для триммера 2.4 - 3 мм, посадка 25.4 мм Тундра",https://www.wildberries.ru/catalog/46285610/detail.aspx
Триммер садовый бензиновый с разборной штангой БТР-2500Р Ресанта,https://www.wildberries.ru/catalog/31415608/detail.aspx
Триммер садовый бензиновый БТР-2900П + подарки Ресанта,https://www.wildberries.ru/catalog/25777136/detail.aspx
Садовый триммер электрический YOUMI,https://www.wildberries.ru/catalog/170668239/detail.aspx
Крышка катушки для триммера Bosch ART Easytrim Combitrim Rare-Tool,https://www.wildberries.ru/catalog/98137310/detail.aspx
"Триммерная леска круг GENERAL D1,6 мм L15 м Rezer",https://www.wildberries.ru/catalog/57926908/detail.aspx
Леска для триммера звездочка 15 метров садовая для косилки Meleon,https://www.wildberries.ru/catalog/137599333/detail.aspx
Головка для триммера с цепью Насадка на триммер,https://www.wildberries.ru/catalog/216163147/detail.aspx
Газонокосилка PT 400 512109400 PATRIOT,https://www.wildberries.ru/catalog/140478540/detail.aspx
"Леска для триммера, сечение звезда, d=2 мм, 170 м Тундра",https://www.wildberries.ru/catalog/33614143/detail.aspx
"Головка триммерная М12*1,5-М 145мм Stihl FS Левая оранж кн Darlon",https://www.wildberries.ru/catalog/146740935/detail.aspx
Редуктор нижний для бензокосы триммер 7 шлицов D-28мм GaminGo,https://www.wildberries.ru/catalog/148677588/detail.aspx
Леска для триммера армированная DVAhome's,https://www.wildberries.ru/catalog/162040798/detail.aspx
"Триммер аккумуляторный 24V, 28 см, с АКБ 2АЧ и ЗУ Greenworks",https://www.wildberries.ru/catalog/16657221/detail.aspx
Триммер садовый электрический VeraLisDom,https://www.wildberries.ru/catalog/122963071/detail.aspx
"Триммер-кусторез аккумуляторный садовый GET-3,6H Huter",https://www.wildberries.ru/catalog/164327970/detail.aspx
"Триммер электрический 350Вт дачный, для садового газона, лес… Denzel",https://www.wildberries.ru/catalog/81316383/detail.aspx
Нож для триммера насадка для триммера диск для триммера HomaLand,https://www.wildberries.ru/catalog/166793445/detail.aspx
Катушка для триммера садового 96365 Denzel,https://www.wildberries.ru/catalog/145993206/detail.aspx
"Триммер электрический Арт. 21117, 280W, 20 см Greenworks",https://www.wildberries.ru/catalog/8144803/detail.aspx
"Леска для триммера 2 мм на 15 м. Сечение ""Квадрат"" 3-ON",https://www.wildberries.ru/catalog/211780093/detail.aspx
Леска для триммера d 2 мм x 63 м сечение бесшумная STARTUL,https://www.wildberries.ru/catalog/81540326/detail.aspx
Триммер садовый электрический BR-1600P электрокоса Brait,https://www.wildberries.ru/catalog/155359656/detail.aspx
Триммер электрический Small Cut Plus 350 23 Gardena,https://www.wildberries.ru/catalog/147036174/detail.aspx
Триммер электрический ГКС-3515 СОЮЗ,https://www.wildberries.ru/catalog/147159403/detail.aspx
"Триммер аккумуляторный GD40BC, 40V, 40 см, бесщеточный, без… Greenworks",https://www.wildberries.ru/catalog/21294418/detail.aspx
Леска для триммера (бухта) NEW серебро 4.0мм x 200м звезда с… Seb,https://www.wildberries.ru/catalog/83399827/detail.aspx
Триммер для травы Zip Trim Газонокосилка садовый Irresistible Home Store,https://www.wildberries.ru/catalog/161016384/detail.aspx
