title,url
Бензиновый триммер GGT-800S двухтактный Huter,https://www.wildberries.ru/catalog/111931636/detail.aspx
"Леска для триммера нейлон круг 1,6 мм 15 м Polyagro",https://www.wildberries.ru/catalog/155361965/detail.aspx
Головка режущая в сборе Калибр,https://www.wildberries.ru/catalog/51504829/detail.aspx
Триммер садовый бензиновый БТР-2500Р + подарки Ресанта,https://www.wildberries.ru/catalog/25777135/detail.aspx
"Леска для триммера ""ЗВЕЗДА"" SIAT",https://www.wildberries.ru/catalog/90461580/detail.aspx
"леска с катушкой для триммера, головка, насадка паук Катушка для триммера",https://www.wildberries.ru/catalog/161411938/detail.aspx
Катушка триммерная GT3513-67 Sturm!,https://www.wildberries.ru/catalog/160976857/detail.aspx
"Леска для триммера 2,4мм звезда PATRIOT",https://www.wildberries.ru/catalog/100639971/detail.aspx
Аккумуляторный триммер электрический с колесами 2 акб SmartLive,https://www.wildberries.ru/catalog/169512541/detail.aspx
Мотокоса BC-241 DGM,https://www.wildberries.ru/catalog/83382979/detail.aspx
Нож для триммера TBM-4 PATRIOT,https://www.wildberries.ru/catalog/55252473/detail.aspx
"Триммер аккумуляторный садовый ТR-200, 21 В Vargonic",https://www.wildberries.ru/catalog/188746909/detail.aspx
Катушка для триммера универсальная TORGWIN,https://www.wildberries.ru/catalog/167989966/detail.aspx
Электрический триммер садовый для травы Denzel,https://www.wildberries.ru/catalog/150632413/detail.aspx
Леска для триммера звезда витая 3 мм 100 м Polyagro,https://www.wildberries.ru/catalog/145821980/detail.aspx
Катушка для аккумуляторного триммера RТ300-36 (96369) Denzel,https://www.wildberries.ru/catalog/50322441/detail.aspx
Катушка для аккумуляторного триммера RТ300-36 96369 DENZEL,https://www.wildberries.ru/catalog/164314625/detail.aspx
Электрический триммер садовый для травы GET-600 Huter,https://www.wildberries.ru/catalog/27531308/detail.aspx
"Триммер аккумуляторный GreenCut 20, 20В, 2 акб Zitrek",https://www.wildberries.ru/catalog/73386922/detail.aspx
Катушка для триммера универсальная паук головка триммерная ,https://www.wildberries.ru/catalog/165565076/detail.aspx
"Триммерная леска звезда, 2,4 мм, 15 м 777Home",https://www.wildberries.ru/catalog/211786325/detail.aspx
Леска для триммера усиленная 2мм витой квадрат Yanis_Shop,https://www.wildberries.ru/catalog/163880374/detail.aspx
Нож металлический для аккумуляторного триммера 4 шт SmartLive,https://www.wildberries.ru/catalog/173491947/detail.aspx
Леска для триммера витой квадрат от 2 до 4мм длина 15м VERTEXTOOLS,https://www.wildberries.ru/catalog/66910685/detail.aspx
