title,url
"Леска для триммера 2,0 мм витой квадрат. Длина 15 м 3-ON",https://www.wildberries.ru/catalog/154251555/detail.aspx
Леска триммерная 1000 Каталог,https://www.wildberries.ru/catalog/142224421/detail.aspx
Плечевые ремни для триммеров Тундра,https://www.wildberries.ru/catalog/139336967/detail.aspx
Триммер аккумуляторный для травы ручной садовый для газона DECK,https://www.wildberries.ru/catalog/164127773/detail.aspx
Катушка для триммера триммерная головка ДРЕЛЛЕР,https://www.wildberries.ru/catalog/90513020/detail.aspx
Катушка для лески триммерная PATRIOT,https://www.wildberries.ru/catalog/149951164/detail.aspx
"Триммер бензиновый DTS-43S, 43 см3, разъемная штанга, состои DENZEL",https://www.wildberries.ru/catalog/162278346/detail.aspx
Триммер садовый электрический ТСВ-38-1300 ЗУБР,https://www.wildberries.ru/catalog/170844853/detail.aspx
Триммер электрический SmallCut 300 23 с катушкой лески Gardena,https://www.wildberries.ru/catalog/147036164/detail.aspx
"Катушка DL-1224 для триммеров TR 240 Li, TR 235 Li Patriot",https://www.wildberries.ru/catalog/154942288/detail.aspx
редуктор для триммера B0603 Maxtoolgroup,https://www.wildberries.ru/catalog/100669940/detail.aspx
Катушка триммерная (полуавтомат) Кузьмич,https://www.wildberries.ru/catalog/27127862/detail.aspx
Леска для триммера Oregon,https://www.wildberries.ru/catalog/83815761/detail.aspx
Леска для триммера Oregon,https://www.wildberries.ru/catalog/83816649/detail.aspx
Леска для триммера Oregon,https://www.wildberries.ru/catalog/81727495/detail.aspx
"Леска для триммера - армированная - d=3 мм, 5 м ТУНДRА",https://www.wildberries.ru/catalog/152645052/detail.aspx
"Леска для триммера 2 мм х 30 см, круглая, 50 шт, 96100 удалить",https://www.wildberries.ru/catalog/28680567/detail.aspx
Катушка для триммера головка триммерная tlong,https://www.wildberries.ru/catalog/165590839/detail.aspx
"Триммер Т 43Р Промо, 43 см3, 1.8 л.с, захват 25 44 см ELITECH",https://www.wildberries.ru/catalog/11450101/detail.aspx
Триммер садовый Газонокосилка PROtech 18В Edon,https://www.wildberries.ru/catalog/163728166/detail.aspx
"Катушка для триммера M10 x 1.25 левая, полуавтомат ZAMENA PRO",https://www.wildberries.ru/catalog/83429888/detail.aspx
Триммер садовый электрический для травы мотокоса TE-90 OASIS,https://www.wildberries.ru/catalog/141119610/detail.aspx
Катушка для тримера М10х1.25 левая резьба VERTEXTOOLS,https://www.wildberries.ru/catalog/170236672/detail.aspx
Катушка для триммера Головка универсальная Шпуля HomaDacha,https://www.wildberries.ru/catalog/32913152/detail.aspx
Ножи для аккумуляторного электрического садового триммера Garden Shop,https://www.wildberries.ru/catalog/168700358/detail.aspx
"Катушка для триммера с леской 1,65 мм и крышкой, 2926207 Greenworks",https://www.wildberries.ru/catalog/169000377/detail.aspx
Ремень ранцевый для триммера на два плеча универсальный АгроЗапчасть,https://www.wildberries.ru/catalog/139635050/detail.aspx
Ремень ранцевый для триммера BT-PRO Huter,https://www.wildberries.ru/catalog/207674185/detail.aspx
"Леска для триммера Profi 2 мм, 15 м, профиль""круг"" kwb",https://www.wildberries.ru/catalog/28882459/detail.aspx
"Леска для триммера сечение ""витой квадрат"" 3,0 мм х 200 м РОКОТ",https://www.wildberries.ru/catalog/158473391/detail.aspx
"Триммер электрический сетевой GL8033-QS, 800 Вт, 33 см Black+Decker",https://www.wildberries.ru/catalog/11299127/detail.aspx
Триммер колесный бензиновый CHAMPION,https://www.wildberries.ru/catalog/170536276/detail.aspx
Триммер бензиновый садовый бензокоса для травы TR-2500T Eurolux,https://www.wildberries.ru/catalog/173670544/detail.aspx
Триммер бензиновый садовый бензокоса косилка Бтр2500П Проф Ресанта,https://www.wildberries.ru/catalog/175645986/detail.aspx
Триммер бензиновый садовый бензокоса косилка Бтр-1900П Ресанта,https://www.wildberries.ru/catalog/175645983/detail.aspx
Триммер садовый бензиновый Ресанта,https://www.wildberries.ru/catalog/35889523/detail.aspx
"Триммер бензиновый садовый PT 543, 2.5лс PATRIOT",https://www.wildberries.ru/catalog/174434092/detail.aspx
"Триммер бензиновый садовый PT 453 (1+1), 3лс PATRIOT",https://www.wildberries.ru/catalog/174432253/detail.aspx
Триммер бензиновый садовый бензокоса косилка КС-1800Р Сибртех,https://www.wildberries.ru/catalog/193456294/detail.aspx
Пластиковая крышка головки триммера SmartLive,https://www.wildberries.ru/catalog/169868438/detail.aspx
Триммер садовый ЭТ-20-2ЛИ Ресанта,https://www.wildberries.ru/catalog/32788767/detail.aspx
"Ремень для триммера, бензокосы ранцевый DreamMarkt",https://www.wildberries.ru/catalog/36485887/detail.aspx
"Триммер садовый ЭТ-600, 600Вт, ширина - 320мм Ресанта",https://www.wildberries.ru/catalog/32790048/detail.aspx
Леска для триммера звезда 3 мм катушка 144 метра TOOLAS,https://www.wildberries.ru/catalog/111124662/detail.aspx
Леска для триммера 2шт ЕкаФи,https://www.wildberries.ru/catalog/164844986/detail.aspx
"Леска для триммера 2,0 мм, с графитовым наполнителем 15 м TORGWIN",https://www.wildberries.ru/catalog/167972114/detail.aspx
Бензиновый колёсный триммер GGT-2900W Huter,https://www.wildberries.ru/catalog/143613158/detail.aspx
катушка для триммера Триммерная головка,https://www.wildberries.ru/catalog/114817563/detail.aspx
Триммер электрический садовый OASIS TOOLS,https://www.wildberries.ru/catalog/81362295/detail.aspx
Ножи для аккумуляторного электрического садового триммера SmartLive,https://www.wildberries.ru/catalog/168690470/detail.aspx
Леска для триммера витой квадрат 3 мм Misslight,https://www.wildberries.ru/catalog/160929463/detail.aspx
"Леска для триммера 2 мм, 2,4мм, 3 мм TRIMMER LINE",https://www.wildberries.ru/catalog/162441761/detail.aspx
Триммер-газонокосилка аккумуляторный GreenCut 12 Pro Zitrek,https://www.wildberries.ru/catalog/149454137/detail.aspx
редуктор для триммера B0121B Maxtoolgroup,https://www.wildberries.ru/catalog/100678579/detail.aspx
Ремень для триммеров PBL-155 PATRIOT,https://www.wildberries.ru/catalog/200495905/detail.aspx
Ранцевый наплечный ремень для триммеров BT-PRO Huter,https://www.wildberries.ru/catalog/78480016/detail.aspx
"Леска для триммера круг 2,4 мм 15 м Polyagro",https://www.wildberries.ru/catalog/145821984/detail.aspx
"Головка триммерная с леской в сборе 40V, 2926507 Greenworks",https://www.wildberries.ru/catalog/168996051/detail.aspx
Ремень ранцевый для триммера ДРЕЛЛЕР,https://www.wildberries.ru/catalog/91987787/detail.aspx
Ремень для триммера ранцевый разгрузочный TITAN,https://www.wildberries.ru/catalog/73460616/detail.aspx
"Леска для триммера 2.7 мм х 202 м, звезда, полиамид, 96287 Denzel",https://www.wildberries.ru/catalog/156358322/detail.aspx
Катушка для триммера Rezer,https://www.wildberries.ru/catalog/170796943/detail.aspx
"Леска для триммера 3 мм на 15 м. Сечение ""Квадрат"" 3-ON",https://www.wildberries.ru/catalog/160724073/detail.aspx
"Леска «МастерАлмаз», Квадрат, 3мм*55м на бобине 0,5кг МастерАлмаз",https://www.wildberries.ru/catalog/138273815/detail.aspx
"Леска для триммера 4.0 мм х 93 м, звезда, полиамид, 96289 Denzel",https://www.wildberries.ru/catalog/156358324/detail.aspx
Леска для триммера звезда 3 мм 100 м Polyagro,https://www.wildberries.ru/catalog/145821999/detail.aspx
"Леска для триммера 2,4мм 15м круг Леска для триммера (круг со стержнем) 2,4*15м",https://www.wildberries.ru/catalog/118020537/detail.aspx
Триммер садовый бензиновый Газонокосилка KZ-4200V S KRONA,https://www.wildberries.ru/catalog/166408250/detail.aspx
Леска для триммера звезда 15м Polyagro,https://www.wildberries.ru/catalog/155361956/detail.aspx
"Леска для триммеров, квадрат 2,5 мм, 15м CET",https://www.wildberries.ru/catalog/25573650/detail.aspx
Бензиновый триммер БТР-2900Р Ресанта,https://www.wildberries.ru/catalog/142946134/detail.aspx
Триммер бензиновый БТР-2500Р Ресанта,https://www.wildberries.ru/catalog/66126863/detail.aspx
"Леска для триммера (круг со стержнем) в рулоне 2,4 220м Бензорем",https://www.wildberries.ru/catalog/31528744/detail.aspx
Леска для триммера (витой квадрат со стержнем) Бензорем,https://www.wildberries.ru/catalog/31528746/detail.aspx
"Нож для триммера (255 мм, 8 зубьев, внутренний диаметр 25,4… Unisaw",https://www.wildberries.ru/catalog/19482551/detail.aspx
Леска триммерная SIAT 3.0 АЛЮМИНИУМ КРУГ 10М Крепыж,https://www.wildberries.ru/catalog/118973947/detail.aspx
Катушка Benzorem,https://www.wildberries.ru/catalog/59138296/detail.aspx
Леска для триммера 3.0 мм. 15 м. круглая Unisaw,https://www.wildberries.ru/catalog/14212448/detail.aspx
Головка триммерная th102 кольцо метал. M10 (картон-пакет) Хопер,https://www.wildberries.ru/catalog/69037159/detail.aspx
Головка триммерная hu202 Большая синяя кнопка M10 Хопер,https://www.wildberries.ru/catalog/69037119/detail.aspx
Леска для триммера summerLil,https://www.wildberries.ru/catalog/91557407/detail.aspx
Леска для триммера summerLil,https://www.wildberries.ru/catalog/91557406/detail.aspx
"Головка триммерная М10х1,25 левая резьба Green Revolution",https://www.wildberries.ru/catalog/73722511/detail.aspx
"Леска для триммера 3,0 мм 15 метров КЛЕВЕР+",https://www.wildberries.ru/catalog/69479600/detail.aspx
Леска для триммера White Wings Village,https://www.wildberries.ru/catalog/30145785/detail.aspx
Леска для триммера Товар,https://www.wildberries.ru/catalog/29175903/detail.aspx
Леска для триммера 1.6 мм 1000 Каталог,https://www.wildberries.ru/catalog/148609051/detail.aspx
Леска для триммера 3мм. 15м-длина 1000 Каталог,https://www.wildberries.ru/catalog/153797451/detail.aspx
Леска для триммера 4мм.и 15м-длина 1000 Каталог,https://www.wildberries.ru/catalog/153798092/detail.aspx
Леска шестиугольник 1000 Каталог,https://www.wildberries.ru/catalog/148907478/detail.aspx
Леска для триммера 1000 Каталог,https://www.wildberries.ru/catalog/149956572/detail.aspx
Прочная леска для триммера 15м Listok,https://www.wildberries.ru/catalog/162348903/detail.aspx
"Леска для триммера квадратная 3,0мм*10м Сибртех",https://www.wildberries.ru/catalog/52555642/detail.aspx
"Леска для триммера, диаметр 3,0 мм, длина 15 м, зеленая TRIMMER LINE",https://www.wildberries.ru/catalog/154988744/detail.aspx
Леска для триммера 15 метров USP ФОРМУЛА УСПЕХА,https://www.wildberries.ru/catalog/94356934/detail.aspx
Леска для триммера SKYWER,https://www.wildberries.ru/catalog/110192975/detail.aspx
Шпулька косильная саморегулирующаяся Beezmoto,https://www.wildberries.ru/catalog/105575810/detail.aspx
"Корд триммерный (леска для триммера) "" Звезда-2,0 15"" КАЛИБР",https://www.wildberries.ru/catalog/12978295/detail.aspx
"Корд триммерный (Леска для триммера) "" Квадрат-3,0 15"" КАЛИБР",https://www.wildberries.ru/catalog/12978298/detail.aspx
"Леска для триммера STAR звезда 2,4мм*15м REDO",https://www.wildberries.ru/catalog/75187065/detail.aspx
"Корд триммерный (Леска для триммера) "" Звезда-3,0 15"" КАЛИБР",https://www.wildberries.ru/catalog/12978299/detail.aspx
Леска для триммера Леска садовая Леска толщина 3.0 Длина 15м V-FORCE PRODUCTS,https://www.wildberries.ru/catalog/75278337/detail.aspx
Леска для триммера Леска садовая Леска толщина 3.0 Длина 15м V-FORCE PRODUCTS,https://www.wildberries.ru/catalog/75278339/detail.aspx
"Леска для триммера витой квадрат ""Зебра"", 2.7мм х 15м ЧЕГЛОК",https://www.wildberries.ru/catalog/111371986/detail.aspx
"Корд триммерный (леска для триммера) "" Квадрат-2,4 15"" КАЛИБР",https://www.wildberries.ru/catalog/12978297/detail.aspx
Леска для триммера сечение квадрат длина 15 м Garden of Gifts,https://www.wildberries.ru/catalog/32034375/detail.aspx
"Корд триммерный (леска для триммера) "" Квадрат-2,0 15"" КАЛИБР",https://www.wildberries.ru/catalog/12978296/detail.aspx
Леска 1000 Каталог,https://www.wildberries.ru/catalog/140479923/detail.aspx
Леска для триммера звезда от 2 до 4мм длина 15м DismaTin,https://www.wildberries.ru/catalog/164060602/detail.aspx
Триммер садовый бензиновый БТР-1900Р Ресанта,https://www.wildberries.ru/catalog/31414549/detail.aspx
Нож для триммера TBS-36 PATRIOT,https://www.wildberries.ru/catalog/55252467/detail.aspx
Триммер бензиновый садовый бензокоса косилка GGT-2500SPRO Huter,https://www.wildberries.ru/catalog/173670549/detail.aspx
"Леска для триммера 1,65мм, 2933407 Greenworks",https://www.wildberries.ru/catalog/169000738/detail.aspx
Диск нож насадка для аккумуляторного триммера 40 зубов Krotof,https://www.wildberries.ru/catalog/141831474/detail.aspx
Леска для триммера Denzel,https://www.wildberries.ru/catalog/200424191/detail.aspx
"Леска для триммера 2.7 мм х 196 м, витой квадрат, 96299 Denzel",https://www.wildberries.ru/catalog/156358343/detail.aspx
Леска для триммера Trimmerline,https://www.wildberries.ru/catalog/159939351/detail.aspx
Ножи пластиковые для аккумуляторного триммера 5 шт Krotof,https://www.wildberries.ru/catalog/141831475/detail.aspx
Бензиновый колёсный триммер GGT-2900W Huter,https://www.wildberries.ru/catalog/165116345/detail.aspx
Бензиновый триммер GGT-2900S PRO Huter,https://www.wildberries.ru/catalog/165116343/detail.aspx
Бензиновый триммер GGT-2900S Huter,https://www.wildberries.ru/catalog/38125001/detail.aspx
"Триммер акк Арт. 2101507UA, 40V, 30 см, с 1хАКБ 2 Ач и ЗУ Greenworks",https://www.wildberries.ru/catalog/14125142/detail.aspx
"Ручной триммер садовый бензиновый мощный, косилка для травы ДИОЛД",https://www.wildberries.ru/catalog/181170424/detail.aspx
"Катушка для триммера ""Паук"", насадка, головка для триммера MaxBoom",https://www.wildberries.ru/catalog/169751629/detail.aspx
"Крышка головки триммера пластиковая зеленая, 2908107 Greenworks",https://www.wildberries.ru/catalog/22901646/detail.aspx
Триммер садовый Huter,https://www.wildberries.ru/catalog/35889629/detail.aspx
"Леска для триммера 1,6 диаметр Green Belt",https://www.wildberries.ru/catalog/204927447/detail.aspx
"Леска для триммера 1,6 диаметр Green Belt",https://www.wildberries.ru/catalog/204927446/detail.aspx
"Леска для триммера 1,6 диаметр Green Belt",https://www.wildberries.ru/catalog/204927444/detail.aspx
Катушка для триммера универсальная шпуля TORGWIN,https://www.wildberries.ru/catalog/168001365/detail.aspx
Катушка для триммера Головка универсальная Шпуля HomaDacha,https://www.wildberries.ru/catalog/166697515/detail.aspx
Катушка с леской для LTR 18 Battery 2.444-014.0 Karcher,https://www.wildberries.ru/catalog/153903884/detail.aspx
"Триммер бензиновый, бензотриммер, бензокоса TR-2500S EUROLUX",https://www.wildberries.ru/catalog/117942553/detail.aspx
Катушка для триммера ECHO GT22-GES HT47 CHAMPION,https://www.wildberries.ru/catalog/162045676/detail.aspx
Бензиновый триммер CHAMPION T523 Сhampion,https://www.wildberries.ru/catalog/211871721/detail.aspx
"Триммер аккумуляторный GET-40-3 Li, 70 1 11 Huter",https://www.wildberries.ru/catalog/161610980/detail.aspx
Электрический триммер FAVOURITE GT 1300 FAVOURITE электроинструмент,https://www.wildberries.ru/catalog/199719575/detail.aspx
"Триммер садовый, электрокосилка PT 500 PATRIOT",https://www.wildberries.ru/catalog/166304997/detail.aspx
"Триммер акк Арт. 2107207SA, 24V, 25 см, с 1хАКБ 2Ач и ЗУ Greenworks",https://www.wildberries.ru/catalog/110422356/detail.aspx
Триммер садовый электрический ЭТ-1000 + подарки Ресанта,https://www.wildberries.ru/catalog/25777148/detail.aspx
Катушка для триммера Y-A002 TITAN /,https://www.wildberries.ru/catalog/174861525/detail.aspx
"Леска «МастерАлмаз», Круг, 15м * 1,6мм МастерАлмаз",https://www.wildberries.ru/catalog/132242356/detail.aspx
Леска для триммера крученый квадрат с сердечником 2.4mm*15m ХОПЕР,https://www.wildberries.ru/catalog/152649115/detail.aspx
Катушка для триммеров EasyGrassCut Bosch F016800569 Rare-Tool,https://www.wildberries.ru/catalog/156563429/detail.aspx
Катушка для триммера универсальная TITAN,https://www.wildberries.ru/catalog/159576876/detail.aspx
Катушка для триммера Y-A001 TITAN /,https://www.wildberries.ru/catalog/214174662/detail.aspx
Леска для триммера Витой квадрат с сердечником длина 15м AlexShop.,https://www.wildberries.ru/catalog/162652275/detail.aspx
Электрический триммер GET-600 Huter,https://www.wildberries.ru/catalog/150774259/detail.aspx
Триммер бензиновый садовый для травы GGT-1500SX Huter,https://www.wildberries.ru/catalog/176092812/detail.aspx
"Леска для триммера 2.7 мм х 202 м, звезда, полиамид, 96814 Denzel",https://www.wildberries.ru/catalog/157872275/detail.aspx
Триммер аккумуляторный TB400 без акб и зу CHAMPION,https://www.wildberries.ru/catalog/142416313/detail.aspx
Триммер бензиновый GBC-043M (01.001.00022) 1250Вт 1.6 CARVER,https://www.wildberries.ru/catalog/213887749/detail.aspx
Триммер аккумуляторный PXC GC-CT 18 24 Li 3411125 EINHELL,https://www.wildberries.ru/catalog/26427135/detail.aspx
Аккумуляторная коса 1.042-503.0 Karcher,https://www.wildberries.ru/catalog/122324338/detail.aspx
Триммер садовый Karcher,https://www.wildberries.ru/catalog/129442640/detail.aspx
Триммер LTR 36-33 Battery Set 1.444-351.0 Karcher,https://www.wildberries.ru/catalog/137798315/detail.aspx
"Триммер бензиновый садовый для травы PT 555 XT (1+1), мотоко… PATRIOT",https://www.wildberries.ru/catalog/66558683/detail.aspx
Триммер электрический UR3502 1000Вт неразбор.штан. ре MAKITA,https://www.wildberries.ru/catalog/209138894/detail.aspx
"Триммер садовый бензиновый GGT-2900S PRO для скоса травы, бе… Huter",https://www.wildberries.ru/catalog/35889549/detail.aspx
Триммер электрический UR3500 700Вт MAKITA,https://www.wildberries.ru/catalog/213887735/detail.aspx
"Триммер садовый, бытовая техника, садовая техника, сад и дач… Huter",https://www.wildberries.ru/catalog/35889622/detail.aspx
"Триммер Champion, арт. T338S-2 CHAMPION®",https://www.wildberries.ru/catalog/44532983/detail.aspx
Катушка для триммера Головка универсальная Шпуля Насадка HomaLand,https://www.wildberries.ru/catalog/32912959/detail.aspx
Леска для аккумуляторного триммера набор GKR,https://www.wildberries.ru/catalog/167968560/detail.aspx
"Ремень для триммера универсальный с защитой бедра, 96368 Denzel",https://www.wildberries.ru/catalog/16960790/detail.aspx
Головка триммерная с леской 2 мм ТН 4217-1 полуавт WORTEX,https://www.wildberries.ru/catalog/158775540/detail.aspx
"Шпуля с леской для Black&Decker GL250, GL310, GL360 A6226-XJ Rare-Tool",https://www.wildberries.ru/catalog/107051991/detail.aspx
Леска для триммера Витой квадрат с сердечником Бабина 2.7мм VERTEXTOOLS,https://www.wildberries.ru/catalog/26434024/detail.aspx
Катушка для триммера универсальная TORGWIN,https://www.wildberries.ru/catalog/172711327/detail.aspx
Садовый триммер электрический Huter GET-25 ( GET-500 ) ,https://www.wildberries.ru/catalog/150373262/detail.aspx
Корд для триммера звезда МакияжOFF,https://www.wildberries.ru/catalog/160083436/detail.aspx
Леска для триммера Витой квадрат с сердечником Бабина 3мм VERTEXTOOLS,https://www.wildberries.ru/catalog/158851124/detail.aspx
"Леска для триммера, Шестиугольник, 15м*1,6 мм МастерАлмаз",https://www.wildberries.ru/catalog/149293967/detail.aspx
"Бензиновый триммер, бензотриммер, бензокоса GGT-1900S Huter",https://www.wildberries.ru/catalog/28957611/detail.aspx
"Леска для триммера 3,0 мм х 15м моток сечение квадрат Krotof",https://www.wildberries.ru/catalog/149622203/detail.aspx
"Леска для триммера звезда витая 2,4мм 100м Polyagro",https://www.wildberries.ru/catalog/145821972/detail.aspx
Электрический триммер TE-1400 1400вт 420мм 96612 Denzel,https://www.wildberries.ru/catalog/176248982/detail.aspx
"Аккумуляторный триммер GET-28Li, 18 В, 2 Ач, Li-ion Huter",https://www.wildberries.ru/catalog/69483640/detail.aspx
Бензиновый триммер Champion T523 Champion.,https://www.wildberries.ru/catalog/140351371/detail.aspx
Крышка катушки для UniversalGrassCut 18 (1600A01R5J) Rare-Tool,https://www.wildberries.ru/catalog/156562848/detail.aspx
3 мм на катушке 280 метров Леска для триммера,https://www.wildberries.ru/catalog/84080816/detail.aspx
Катушка с леской (шпуля) для бензокосы Oleo-Mac Sparta 25 Бензорем,https://www.wildberries.ru/catalog/66444160/detail.aspx
"Леска для триммера 2,4 мм х 15м моток сечение звезда Krotof",https://www.wildberries.ru/catalog/149622194/detail.aspx
